{
  "schemaVersion": 2,
  "runId": "20261025T195931Z_dotnet_ci-ubuntu-latest_sdk-defaults",
  "timestampUtc": "2026-10-25T19:59:31.6862073\u002B00:00",
  "sdk": {
    "name": "dotnet",
    "version": "0.0.0-alpha.0",
    "runtime": ".NET 10.0.14"
  },
  "environment": {
    "label": "ci-ubuntu-latest",
    "gitSha": "6e88a57feb0d9b99c9a7f5d25d5cfcd712ad04e1",
    "gitBranch": "main",
    "gitDirty": false,
    "os": "Ubuntu 24.04.5 LTS",
    "cpuCount": 4
  },
  "topology": {
    "apiReplicas": 1,
    "schedulerReplicas": 3,
    "loadBalancer": false,
    "server": "testcontainers daprmq-api:test"
  },
  "scale": "pr",
  "scenario": {
    "id": "P-04",
    "name": "session-drain",
    "profile": "sdk-defaults",
    "key": "40x5@1000ms/20slots",
    "params": {
      "sessions": 40,
      "messagesPerSession": 5,
      "settleMs": 1000,
      "maxConcurrentSessions": 20,
      "prefetchCount": 10,
      "leaseSeconds": 30,
      "sessionIdleTimeoutSeconds": 0,
      "publishMode": "before",
      "publishIntervalMs": 0,
      "publishJitterMs": 0
    }
  },
  "metrics": {
    "seedSeconds": 0.0649747,
    "wallClockSeconds": 40.4496425,
    "idealSeconds": 10,
    "efficiency": 0.24722097358462436,
    "timeToFirstMessageSeconds": 0.0173828,
    "tailSeconds": 5.000056100000002,
    "peak": {
      "startSeconds": 0.0173828,
      "endSeconds": 35.4495864,
      "capacitySlotSeconds": 708.644072,
      "handlingSeconds": 118.44043249999997,
      "claimSeconds": 2.248748000000019,
      "inSessionWaitSeconds": 0.0035820999999759805,
      "drainWaitSeconds": 586.9517160000001,
      "betweenStreamsSeconds": 0.9995934000001289,
      "idleSlotSeconds": 590.2036395000001,
      "utilization": 0.16713670117316662
    },
    "overall": {
      "startSeconds": 0,
      "endSeconds": 40.4496425,
      "capacitySlotSeconds": 808.9928500000001,
      "handlingSeconds": 200.01502169999992,
      "claimSeconds": 2.5936855000000185,
      "inSessionWaitSeconds": 0.00762510000004022,
      "drainWaitSeconds": 605.3742090000003,
      "betweenStreamsSeconds": 1.002308699999936,
      "idleSlotSeconds": 608.9778283000002,
      "utilization": 0.24723954198111875
    },
    "claimLatencyMs": {
      "count": 40,
      "mean": 62.442562500000484,
      "p50": 59.676899999999996,
      "p95": 111.35650000000169,
      "p99": 119.61290000000008,
      "max": 119.61290000000008
    },
    "drainWaitMs": {
      "count": 40,
      "mean": 15173.4617925,
      "p50": 1136.1588000000047,
      "p95": 29385.450799999995,
      "p99": 29389.083899999998,
      "max": 29389.083899999998
    },
    "interMessageGapMs": {
      "count": 160,
      "mean": 0.047345625000316006,
      "p50": 0.03960000000006403,
      "p95": 0.09590000000025611,
      "p99": 0.12120000000140863,
      "max": 0.2554999999993015
    },
    "deliveryLatencyMs": {
      "count": 200,
      "mean": 19365.805,
      "p50": 5150,
      "p95": 38514,
      "p99": 38558,
      "max": 39469
    },
    "streams": 41,
    "failedClaims": 1,
    "sessionsClaimedMoreThanOnce": 0,
    "messagesHandled": 200,
    "duplicates": 0,
    "missing": 0,
    "fifoViolations": 0
  },
  "checks": {
    "passed": true,
    "failures": []
  },
  "timeline": {
    "bucketMs": 1000,
    "series": {
      "busySlots": [
        17.883,
        19.896,
        19.999,
        19.999,
        19.999,
        2.124,
        0.105,
        0,
        0,
        0,
        0,
        0,
        0,
        0,
        0,
        0,
        0,
        0,
        0,
        0,
        0,
        0,
        0,
        0,
        0,
        0,
        0,
        0,
        0,
        0,
        0,
        0,
        0,
        0,
        9.893,
        19.549,
        19.999,
        19.999,
        19.999,
        10.121,
        0.45
      ]
    }
  }
}