{
  "schemaVersion": 2,
  "runId": "20261025T195831Z_typescript_ci-ubuntu-latest_dequeue-ack",
  "timestampUtc": "2026-10-25T19:58:31.411Z",
  "sdk": {
    "name": "typescript",
    "version": "0.0.0-alpha.0",
    "runtime": "Node 22.23.3"
  },
  "environment": {
    "label": "ci-ubuntu-latest",
    "gitSha": "6e88a57feb0d9b99c9a7f5d25d5cfcd712ad04e1",
    "gitBranch": "main",
    "gitDirty": false,
    "os": "Linux 6.17.0-1022-azure",
    "cpuCount": 4
  },
  "topology": {
    "apiReplicas": 1,
    "schedulerReplicas": 3,
    "loadBalancer": false,
    "server": "testcontainers daprmq-api:test"
  },
  "scale": "pr",
  "scenario": {
    "id": "P-03",
    "name": "dequeue-ack",
    "profile": "dequeue-ack",
    "key": "dequeue-ack:c8/q8/k1/seed4000/256B/3+15s",
    "params": {
      "concurrency": [
        8
      ],
      "queues": 8,
      "batchSize": 1,
      "dequeueCount": 1,
      "payloadBytes": 256,
      "seedPerQueue": 4000,
      "warmupSeconds": 3,
      "durationSeconds": 15
    }
  },
  "metrics": {
    "opsPerSecond": 477.6,
    "messagesPerSecond": 477.6,
    "latencyMs": {
      "count": 7164,
      "mean": 16.74703007984364,
      "p50": 16.15932600000815,
      "p95": 23.704638000010164,
      "p99": 28.69515699999465,
      "max": 46.916935000001104
    },
    "ops": 7164,
    "messages": 7164,
    "errors": 0
  },
  "checks": {
    "passed": true,
    "failures": []
  },
  "steps": [
    {
      "concurrency": 8,
      "queues": 8,
      "durationSeconds": 15,
      "ops": 7164,
      "messages": 7164,
      "errors": 0,
      "opsPerSecond": 477.6,
      "messagesPerSecond": 477.6,
      "latencyMs": {
        "count": 7164,
        "mean": 16.74703007984364,
        "p50": 16.15932600000815,
        "p95": 23.704638000010164,
        "p99": 28.69515699999465,
        "max": 46.916935000001104
      }
    }
  ],
  "timeline": {
    "bucketMs": 1000,
    "series": {
      "opsPerSecond": [
        493,
        471,
        473,
        488,
        441,
        518,
        465,
        470,
        487,
        449,
        522,
        465,
        486,
        481,
        455
      ],
      "messagesPerSecond": [
        493,
        471,
        473,
        488,
        441,
        518,
        465,
        470,
        487,
        449,
        522,
        465,
        486,
        481,
        455
      ],
      "latencyP50Ms": [
        15.817,
        16.676,
        16.162,
        15.654,
        17.698,
        14.968,
        16.44,
        16.08,
        15.786,
        17.187,
        14.908,
        16.493,
        15.921,
        15.752,
        17.009
      ],
      "latencyP95Ms": [
        23.454,
        23.035,
        24.159,
        22.511,
        24.742,
        21.575,
        24.811,
        25.21,
        23.387,
        25.288,
        21.191,
        24.485,
        22.884,
        23.585,
        23.655
      ],
      "latencyP99Ms": [
        29.79,
        26.379,
        37.192,
        27.469,
        27.566,
        25.014,
        29.139,
        35.996,
        27.733,
        31.188,
        24.728,
        29.08,
        27.599,
        28.242,
        27.255
      ],
      "errors": [
        0,
        0,
        0,
        0,
        0,
        0,
        0,
        0,
        0,
        0,
        0,
        0,
        0,
        0,
        0
      ],
      "concurrency": [
        8,
        8,
        8,
        8,
        8,
        8,
        8,
        8,
        8,
        8,
        8,
        8,
        8,
        8,
        8
      ]
    }
  }
}