{
  "schemaVersion": 2,
  "runId": "20261019T193713Z_python_ci-ubuntu-latest_enqueue-hot",
  "timestampUtc": "2026-10-19T19:37:13.252696+00:00",
  "sdk": {
    "name": "python",
    "version": "0.0.0a0",
    "runtime": "CPython 3.12.15"
  },
  "environment": {
    "label": "ci-ubuntu-latest",
    "gitSha": "98fd4a2d3cbbe96d55c562f8a001c29be96cdf3f",
    "gitBranch": "main",
    "gitDirty": false,
    "os": "Linux-6.17.0-1022-azure-x86_64-with-glibc2.39",
    "cpuCount": 4
  },
  "topology": {
    "apiReplicas": 1,
    "schedulerReplicas": 3,
    "loadBalancer": false,
    "server": "testcontainers daprmq-api:test"
  },
  "scale": "pr",
  "scenario": {
    "id": "P-01",
    "name": "enqueue",
    "profile": "enqueue-hot",
    "key": "enqueue:c8/q1/b1/256B/3+15s",
    "params": {
      "concurrency": [
        8
      ],
      "queues": 1,
      "batchSize": 1,
      "dequeueCount": 1,
      "payloadBytes": 256,
      "seedPerQueue": 0,
      "warmupSeconds": 3,
      "durationSeconds": 15
    }
  },
  "metrics": {
    "opsPerSecond": 265.3333333333333,
    "messagesPerSecond": 265.3333333333333,
    "latencyMs": {
      "count": 3980,
      "mean": 30.144586230653115,
      "p50": 29.958279999988008,
      "p95": 38.925064000011844,
      "p99": 43.64334499999313,
      "max": 56.76865500001304
    },
    "ops": 3980,
    "messages": 3980,
    "errors": 0
  },
  "checks": {
    "passed": true,
    "failures": []
  },
  "steps": [
    {
      "concurrency": 8,
      "queues": 1,
      "durationSeconds": 15.0,
      "ops": 3980,
      "messages": 3980,
      "errors": 0,
      "opsPerSecond": 265.3333333333333,
      "messagesPerSecond": 265.3333333333333,
      "latencyMs": {
        "count": 3980,
        "mean": 30.144586230653115,
        "p50": 29.958279999988008,
        "p95": 38.925064000011844,
        "p99": 43.64334499999313,
        "max": 56.76865500001304
      }
    }
  ],
  "timeline": {
    "bucketMs": 1000,
    "series": {
      "opsPerSecond": [
        232,
        243,
        248,
        234,
        277,
        273,
        273,
        271,
        281,
        274,
        275,
        271,
        277,
        280,
        271
      ],
      "messagesPerSecond": [
        232,
        243,
        248,
        234,
        277,
        273,
        273,
        271,
        281,
        274,
        275,
        271,
        277,
        280,
        271
      ],
      "latencyP50Ms": [
        32.954,
        32.773,
        31.422,
        34.806,
        28.851,
        27.927,
        29.174,
        29.427,
        28.458,
        29.064,
        29.018,
        28.667,
        28.614,
        28.497,
        29.548
      ],
      "latencyP95Ms": [
        43.689,
        40.524,
        40.377,
        45.331,
        36.255,
        38.361,
        36.138,
        35.35,
        37.907,
        35.52,
        36.058,
        35.659,
        37.122,
        34.373,
        37.544
      ],
      "latencyP99Ms": [
        54.207,
        41.536,
        43.846,
        46.604,
        40.079,
        40.533,
        36.634,
        38.127,
        40.529,
        37.684,
        45.877,
        38.756,
        40.093,
        35.573,
        39.611
      ],
      "errors": [
        0,
        0,
        0,
        0,
        0,
        0,
        0,
        0,
        0,
        0,
        0,
        0,
        0,
        0,
        0
      ],
      "concurrency": [
        8,
        8,
        8,
        8,
        8,
        8,
        8,
        8,
        8,
        8,
        8,
        8,
        8,
        8,
        8
      ]
    }
  }
}