{
  "schemaVersion": 2,
  "runId": "20261026T094406Z_python_ci-ubuntu-latest_session-churn",
  "timestampUtc": "2026-10-26T09:44:06.403420+00:00",
  "sdk": {
    "name": "python",
    "version": "0.0.0a0",
    "runtime": "CPython 3.12.15"
  },
  "environment": {
    "label": "ci-ubuntu-latest",
    "gitSha": "87bc02c189b560c27e0223b2fccdba6bf0762def",
    "gitBranch": "main",
    "gitDirty": false,
    "os": "Linux-6.17.0-1022-azure-x86_64-with-glibc2.39",
    "cpuCount": 4
  },
  "topology": {
    "apiReplicas": 1,
    "schedulerReplicas": 3,
    "loadBalancer": false,
    "server": "testcontainers daprmq-api:test"
  },
  "scale": "pr",
  "scenario": {
    "id": "P-04",
    "name": "session-drain",
    "profile": "session-churn",
    "key": "300x2@50ms/20slots+idle1s",
    "params": {
      "sessions": 300,
      "messagesPerSession": 2,
      "settleMs": 50,
      "maxConcurrentSessions": 20,
      "prefetchCount": 10,
      "leaseSeconds": 30,
      "sessionIdleTimeoutSeconds": 1,
      "publishMode": "before",
      "publishIntervalMs": 0,
      "publishJitterMs": 0
    }
  },
  "metrics": {
    "seedSeconds": 1.7309781269999576,
    "wallClockSeconds": 14.196601405000022,
    "idealSeconds": 1.5,
    "efficiency": 0.10565909101819976,
    "timeToFirstMessageSeconds": 0.01621087900002749,
    "tailSeconds": 0.10171010800001931,
    "peak": {
      "startSeconds": 0.01621087900002749,
      "endSeconds": 14.094891297000004,
      "capacitySlotSeconds": 281.5736083599995,
      "handlingSeconds": 29.860094664000364,
      "claimSeconds": 10.702925187999547,
      "inSessionWaitSeconds": 0.14751941699955295,
      "drainWaitSeconds": 240.85511721999976,
      "betweenStreamsSeconds": 0.00795187100028852,
      "idleSlotSeconds": 251.71351369599915,
      "utilization": 0.10604720676031335
    },
    "overall": {
      "startSeconds": 0.0,
      "endSeconds": 14.196601405000022,
      "capacitySlotSeconds": 283.9320281000005,
      "handlingSeconds": 30.36988191300037,
      "claimSeconds": 11.000322286999738,
      "inSessionWaitSeconds": 0.14887916999958498,
      "drainWaitSeconds": 242.37818173600024,
      "betweenStreamsSeconds": 0.03476299400062999,
      "idleSlotSeconds": 253.5621461870001,
      "utilization": 0.10696180390858948
    },
    "claimLatencyMs": {
      "count": 300,
      "mean": 36.667740956665796,
      "p50": 33.18742700002986,
      "p95": 62.05474199998662,
      "p99": 123.6297620000073,
      "max": 143.58493000003136
    },
    "drainWaitMs": {
      "count": 300,
      "mean": 811.4602267699996,
      "p50": 902.7907880000043,
      "p95": 905.4612049999942,
      "p99": 906.7894140000008,
      "max": 911.2936429999645
    },
    "interMessageGapMs": {
      "count": 300,
      "mean": 0.4533506133331336,
      "p50": 0.37904100003061103,
      "p95": 0.815600999999333,
      "p99": 1.2284379999982775,
      "max": 3.2644080000068243
    },
    "deliveryLatencyMs": {
      "count": 600,
      "mean": 7968.043333333333,
      "p50": 7943,
      "p95": 14077,
      "p99": 14276,
      "max": 14457
    },
    "streams": 300,
    "failedClaims": 0,
    "sessionsClaimedMoreThanOnce": 0,
    "messagesHandled": 600,
    "duplicates": 0,
    "missing": 0,
    "fifoViolations": 0
  },
  "checks": {
    "passed": true,
    "failures": []
  },
  "timeline": {
    "bucketMs": 1000,
    "series": {
      "busySlots": [
        2.671,
        2.015,
        2.002,
        2.083,
        1.976,
        1.993,
        2.097,
        2.05,
        1.939,
        2.066,
        2.003,
        2.048,
        2.029,
        1.979,
        1.418
      ]
    }
  }
}