{
  "schemaVersion" : 2,
  "runId" : "20261013T151726Z_java_ci-ubuntu-latest_steady-drain",
  "timestampUtc" : "2026-10-13T15:17:26.797591019Z",
  "sdk" : {
    "name" : "java",
    "version" : null,
    "runtime" : "OpenJDK 64-Bit Server VM 17.0.20.1"
  },
  "environment" : {
    "label" : "ci-ubuntu-latest",
    "gitSha" : "c840539f4d5ae0df0b4aa1ff0bc7ee8a5f9ec848",
    "gitBranch" : "main",
    "gitDirty" : false,
    "os" : "Linux 6.17.0-1022-azure",
    "cpuCount" : 4
  },
  "topology" : {
    "apiReplicas" : 1,
    "schedulerReplicas" : 3,
    "loadBalancer" : false,
    "server" : "testcontainers daprmq-api:test"
  },
  "scale" : "pr",
  "scenario" : {
    "id" : "P-04",
    "name" : "session-drain",
    "profile" : "steady-drain",
    "key" : "200x20@100ms/20slots+idle1s",
    "params" : {
      "sessions" : 200,
      "messagesPerSession" : 20,
      "settleMs" : 100,
      "maxConcurrentSessions" : 20,
      "prefetchCount" : 10,
      "leaseSeconds" : 30,
      "sessionIdleTimeoutSeconds" : 1,
      "publishMode" : "before",
      "publishIntervalMs" : 0,
      "publishJitterMs" : 0
    }
  },
  "metrics" : {
    "seedSeconds" : 0.997912315,
    "wallClockSeconds" : 29.609926771999998,
    "idealSeconds" : 20.0,
    "efficiency" : 0.6754491544002256,
    "timeToFirstMessageSeconds" : 0.08196983199999999,
    "tailSeconds" : 2.0024723520000007,
    "peak" : {
      "startSeconds" : 0.08196983199999999,
      "endSeconds" : 27.60745442,
      "capacitySlotSeconds" : 550.50969176,
      "handlingSeconds" : 376.453028494,
      "claimSeconds" : 14.97289373499999,
      "inSessionWaitSeconds" : 0.18310450799997602,
      "drainWaitSeconds" : 158.8818199740001,
      "betweenStreamsSeconds" : 0.018845048999995926,
      "idleSlotSeconds" : 174.056663266,
      "utilization" : 0.6838263415317279
    },
    "overall" : {
      "startSeconds" : 0.0,
      "endSeconds" : 29.609926771999998,
      "capacitySlotSeconds" : 592.19853544,
      "handlingSeconds" : 400.2971105900002,
      "claimSeconds" : 18.60287805899998,
      "inSessionWaitSeconds" : 0.19446894399997927,
      "drainWaitSeconds" : 173.0061527460001,
      "betweenStreamsSeconds" : 0.09792510100000072,
      "idleSlotSeconds" : 191.90142484999978,
      "utilization" : 0.675950862142173
    },
    "claimLatencyMs" : {
      "count" : 200,
      "mean" : 82.65229873499993,
      "p50" : 61.82708199999979,
      "p95" : 241.8482799999997,
      "p99" : 344.267883,
      "max" : 355.71075800000017
    },
    "drainWaitMs" : {
      "count" : 200,
      "mean" : 866.8469296300004,
      "p50" : 931.5343150000008,
      "p95" : 1188.7838889999985,
      "p99" : 1290.482906000001,
      "max" : 1299.551843000001
    },
    "interMessageGapMs" : {
      "count" : 3800,
      "mean" : 0.04559540684209432,
      "p50" : 0.034030999999231426,
      "p95" : 0.10162300000001778,
      "p99" : 0.15660600000001068,
      "max" : 2.078562000000005
    },
    "deliveryLatencyMs" : {
      "count" : 4000,
      "mean" : 14684.27125,
      "p50" : 14579.0,
      "p95" : 27802.0,
      "p99" : 28842.0,
      "max" : 29544.0
    },
    "streams" : 214,
    "failedClaims" : 14,
    "sessionsClaimedMoreThanOnce" : 0,
    "messagesHandled" : 4000,
    "duplicates" : 0,
    "missing" : 0,
    "fifoViolations" : 0
  },
  "checks" : {
    "passed" : true,
    "failures" : [ ]
  },
  "timeline" : {
    "bucketMs" : 1000,
    "series" : {
      "busySlots" : [ 17.271, 19.983, 7.775, 17.856, 15.028, 6.059, 17.765, 16.111, 11.375, 17.97, 10.893, 11.368, 18.184, 10.69, 11.233, 17.784, 10.611, 9.041, 18.485, 13.202, 9.435, 17.984, 12.108, 5.505, 18.067, 16.541, 9.216, 16.758, 12.747, 3.248 ]
    }
  }
}