{
  "schemaVersion": 2,
  "runId": "20261010T183713Z_dotnet_ci-ubuntu-latest_enqueue",
  "timestampUtc": "2026-10-10T18:37:13.1768893\u002B00:00",
  "sdk": {
    "name": "dotnet",
    "version": "0.0.0-alpha.0",
    "runtime": ".NET 10.0.12"
  },
  "environment": {
    "label": "ci-ubuntu-latest",
    "gitSha": "665b8eabcd416937e5e43bb4c380cfdbafc88fd6",
    "gitBranch": "main",
    "gitDirty": false,
    "os": "Ubuntu 24.04.5 LTS",
    "cpuCount": 4
  },
  "topology": {
    "apiReplicas": 1,
    "schedulerReplicas": 3,
    "loadBalancer": false,
    "server": "testcontainers daprmq-api:test"
  },
  "scale": "pr",
  "scenario": {
    "id": "P-01",
    "name": "enqueue",
    "profile": "enqueue",
    "key": "enqueue:c8/q8/b1/256B/3\u002B15s",
    "params": {
      "concurrency": [
        8
      ],
      "queues": 8,
      "batchSize": 1,
      "dequeueCount": 1,
      "payloadBytes": 256,
      "seedPerQueue": 0,
      "warmupSeconds": 3,
      "durationSeconds": 15
    }
  },
  "metrics": {
    "opsPerSecond": 425.93333333333334,
    "messagesPerSecond": 425.93333333333334,
    "latencyMs": {
      "count": 6389,
      "mean": 18.78082966035375,
      "p50": 17.72779999999875,
      "p95": 30.64969999999994,
      "p99": 38.67960000000039,
      "max": 58.60850000000028
    },
    "ops": 6389,
    "messages": 6389,
    "errors": 0
  },
  "checks": {
    "passed": true,
    "failures": []
  },
  "steps": [
    {
      "concurrency": 8,
      "queues": 8,
      "durationSeconds": 15,
      "ops": 6389,
      "messages": 6389,
      "errors": 0,
      "opsPerSecond": 425.93333333333334,
      "messagesPerSecond": 425.93333333333334,
      "latencyMs": {
        "count": 6389,
        "mean": 18.78082966035375,
        "p50": 17.72779999999875,
        "p95": 30.64969999999994,
        "p99": 38.67960000000039,
        "max": 58.60850000000028
      }
    }
  ],
  "timeline": {
    "bucketMs": 1000,
    "series": {
      "opsPerSecond": [
        386,
        484,
        424,
        504,
        446,
        480,
        487,
        345,
        352,
        427,
        437,
        399,
        411,
        374,
        433
      ],
      "messagesPerSecond": [
        386,
        484,
        424,
        504,
        446,
        480,
        487,
        345,
        352,
        427,
        437,
        399,
        411,
        374,
        433
      ],
      "latencyP50Ms": [
        19.238,
        14.963,
        18.295,
        15.074,
        17.98,
        16.008,
        14.82,
        21.706,
        21.382,
        17.917,
        17.253,
        19.26,
        18.94,
        20.561,
        16.72
      ],
      "latencyP95Ms": [
        31.803,
        26.88,
        27.322,
        23.135,
        27.521,
        24.437,
        28.707,
        38.096,
        40.808,
        31.311,
        32.61,
        32.469,
        29.17,
        33.295,
        31.102
      ],
      "latencyP99Ms": [
        39.273,
        34.346,
        29.954,
        27.908,
        32.606,
        29.353,
        35.836,
        45.609,
        53.664,
        33.594,
        39.136,
        38.971,
        35.096,
        42.658,
        37.488
      ],
      "errors": [
        0,
        0,
        0,
        0,
        0,
        0,
        0,
        0,
        0,
        0,
        0,
        0,
        0,
        0,
        0
      ],
      "concurrency": [
        8,
        8,
        8,
        8,
        8,
        8,
        8,
        8,
        8,
        8,
        8,
        8,
        8,
        8,
        8
      ]
    }
  }
}