{
  "schemaVersion" : 2,
  "runId" : "20261010T183743Z_java_ci-ubuntu-latest_enqueue-hot",
  "timestampUtc" : "2026-10-10T18:37:43.310430290Z",
  "sdk" : {
    "name" : "java",
    "version" : null,
    "runtime" : "OpenJDK 64-Bit Server VM 17.0.20.1"
  },
  "environment" : {
    "label" : "ci-ubuntu-latest",
    "gitSha" : "665b8eabcd416937e5e43bb4c380cfdbafc88fd6",
    "gitBranch" : "main",
    "gitDirty" : false,
    "os" : "Linux 6.17.0-1022-azure",
    "cpuCount" : 4
  },
  "topology" : {
    "apiReplicas" : 1,
    "schedulerReplicas" : 3,
    "loadBalancer" : false,
    "server" : "testcontainers daprmq-api:test"
  },
  "scale" : "pr",
  "scenario" : {
    "id" : "P-01",
    "name" : "enqueue",
    "profile" : "enqueue-hot",
    "key" : "enqueue:c8/q1/b1/256B/3+15s",
    "params" : {
      "concurrency" : [ 8 ],
      "queues" : 1,
      "batchSize" : 1,
      "dequeueCount" : 1,
      "payloadBytes" : 256,
      "seedPerQueue" : 0,
      "warmupSeconds" : 3,
      "durationSeconds" : 15
    }
  },
  "metrics" : {
    "opsPerSecond" : 289.06666666666666,
    "messagesPerSecond" : 289.06666666666666,
    "latencyMs" : {
      "count" : 4336,
      "mean" : 27.665894413976034,
      "p50" : 27.002738999999565,
      "p95" : 36.14027200000055,
      "p99" : 47.57263199999943,
      "max" : 57.94551800000045
    },
    "ops" : 4336,
    "messages" : 4336,
    "errors" : 0
  },
  "checks" : {
    "passed" : true,
    "failures" : [ ]
  },
  "steps" : [ {
    "concurrency" : 8,
    "queues" : 1,
    "durationSeconds" : 15.0,
    "ops" : 4336,
    "messages" : 4336,
    "errors" : 0,
    "opsPerSecond" : 289.06666666666666,
    "messagesPerSecond" : 289.06666666666666,
    "latencyMs" : {
      "count" : 4336,
      "mean" : 27.665894413976034,
      "p50" : 27.002738999999565,
      "p95" : 36.14027200000055,
      "p99" : 47.57263199999943,
      "max" : 57.94551800000045
    }
  } ],
  "timeline" : {
    "bucketMs" : 1000,
    "series" : {
      "opsPerSecond" : [ 269, 293, 302, 284, 302, 299, 255, 302, 296, 299, 266, 303, 299, 277, 290 ],
      "messagesPerSecond" : [ 269, 293, 302, 284, 302, 299, 255, 302, 296, 299, 266, 303, 299, 277, 290 ],
      "latencyP50Ms" : [ 29.226, 26.614, 26.04, 28.41, 26.343, 26.026, 29.734, 26.249, 26.594, 26.775, 27.259, 26.49, 26.331, 28.065, 27.028 ],
      "latencyP95Ms" : [ 36.29, 35.224, 32.992, 36.973, 33.939, 33.117, 48.986, 33.106, 34.708, 33.323, 49.328, 33.815, 33.293, 42.34, 35.325 ],
      "latencyP99Ms" : [ 37.848, 39.018, 37.774, 39.291, 35.59, 34.019, 51.144, 33.85, 38.434, 34.761, 56.35, 34.706, 34.931, 51.042, 39.142 ],
      "errors" : [ 0, 0, 0, 0, 0, 0, 0, 0, 0, 0, 0, 0, 0, 0, 0 ],
      "concurrency" : [ 8, 8, 8, 8, 8, 8, 8, 8, 8, 8, 8, 8, 8, 8, 8 ]
    }
  }
}